{
  "benchmark_id": "general--processmsg-case-study--positive",
  "properties": [
    {
      "actual": "TRUE",
      "comparison": "MATCH",
      "counterexample": null,
      "diagnostic": null,
      "expected": "TRUE",
      "logic": "Assertion",
      "phase": "complete",
      "property_id": "processmsg-result-monitor-no-violation",
      "required": true,
      "rmc_name": "ProcessMsg_NoCheckerViolation"
    },
    {
      "actual": "TRUE",
      "comparison": "MATCH",
      "counterexample": null,
      "diagnostic": null,
      "expected": "TRUE",
      "logic": "Assertion",
      "phase": "complete",
      "property_id": "processmsg-zero-message-consistency-invariant",
      "required": true,
      "rmc_name": "ProcessMsg_OkImpliesZeroMessage"
    },
    {
      "actual": "FALSE",
      "comparison": "MATCH",
      "counterexample": {
        "available": true,
        "path": "rmc-properties/raw/processmsg-success-witness/checker.xml"
      },
      "diagnostic": null,
      "expected": "FALSE",
      "logic": "Assertion",
      "phase": "checker",
      "property_id": "processmsg-success-witness",
      "required": true,
      "rmc_name": "ProcessMsg_SuccessNeverReached"
    }
  ],
  "rmc_version": "2.14",
  "schema_version": 1,
  "summary": {
    "matched": 3,
    "mismatched": 0
  },
  "target": "adapted-timed-rebeca-source"
}
