{
  "benchmark_id": "general--fibonacci-case-study--positive",
  "properties": [
    {
      "actual": "TRUE",
      "comparison": "MATCH",
      "counterexample": null,
      "diagnostic": null,
      "expected": "TRUE",
      "logic": "Assertion",
      "phase": "complete",
      "property_id": "fibonacci-result-monitor-no-violation",
      "required": true,
      "rmc_name": "Fibonacci_CorrectResult"
    }
  ],
  "rmc_version": "2.14",
  "schema_version": 1,
  "summary": {
    "matched": 1,
    "mismatched": 0
  },
  "target": "adapted-timed-rebeca-source"
}
