{
  "benchmark_id": "general--aircraftdoor-case-study--positive",
  "properties": [
    {
      "actual": "TRUE",
      "comparison": "MATCH",
      "counterexample": null,
      "diagnostic": null,
      "expected": "TRUE",
      "logic": "Assertion",
      "phase": "complete",
      "property_id": "aircraftdoor-door-monitor-no-violation",
      "required": true,
      "rmc_name": "AircraftDoor_NoMonitorViolation"
    },
    {
      "actual": "FALSE",
      "comparison": "MATCH",
      "counterexample": {
        "available": true,
        "path": "rmc-properties/raw/aircraftdoor-door-open-witness/checker.xml"
      },
      "diagnostic": null,
      "expected": "FALSE",
      "logic": "Assertion",
      "phase": "checker",
      "property_id": "aircraftdoor-door-open-witness",
      "required": true,
      "rmc_name": "AircraftDoor_DoorNeverOpened"
    }
  ],
  "rmc_version": "2.14",
  "schema_version": 1,
  "summary": {
    "matched": 2,
    "mismatched": 0
  },
  "target": "adapted-timed-rebeca-source"
}
