{
  "benchmark_id": "general--smarthome-case-study--positive",
  "properties": [
    {
      "actual": "TRUE",
      "comparison": "MATCH",
      "counterexample": null,
      "diagnostic": null,
      "expected": "TRUE",
      "logic": "Assertion",
      "phase": "complete",
      "property_id": "smarthome-cold-scenario-invariant",
      "required": true,
      "rmc_name": "SmartHome_ColdScenarioSafe"
    },
    {
      "actual": "FALSE",
      "comparison": "MATCH",
      "counterexample": {
        "available": true,
        "path": "rmc-properties/raw/smarthome-heater-actuation-witness/checker.xml"
      },
      "diagnostic": null,
      "expected": "FALSE",
      "logic": "Assertion",
      "phase": "checker",
      "property_id": "smarthome-heater-actuation-witness",
      "required": true,
      "rmc_name": "SmartHome_HeaterNeverTurnsOn"
    }
  ],
  "rmc_version": "2.14",
  "schema_version": 1,
  "summary": {
    "matched": 2,
    "mismatched": 0
  },
  "target": "adapted-timed-rebeca-source"
}
